{
  "$schema": "https://json-schema.org/draft/2020-12/schema",
  "$id": "https://williamzujkowski.github.io/remarque/registry-item.schema.json",
  "title": "Remarque registry item",
  "description": "JSON Schema for one item in Remarque's machine-readable markup-contract registry (registry/<name>.json) — GENERATED by scripts/build-registry.mjs, do not hand-edit. Vendored and adapted from shadcn/ui's registry-item.json (https://ui.shadcn.com/schema/registry-item.json): field NAMES that fit a CSS+HTML markup contract are kept (name, type, title, description, dependencies, registryDependencies, cssVars, docs, files[].path/content/type); fields specific to installable React component registries (tailwind, css, envVars, meta, font, extends/style/iconLibrary/baseColor/theme, files[].target) are omitted because nothing here is installed by a CLI — see REMARQUE.md \"The Registry\" for the full per-field adaptation/omission rationale. `type` does not reuse shadcn's registry:* enum (registry:lib/component/ui/hook/page/...) — none of those describe a dependency-free CSS module plus its known-good markup sample, so this schema mints one honest value instead of stretching an ill-fitting one. `cssVars` and `docs` keep shadcn's field NAME but narrow its MEANING (documented per-property below) rather than its shape, so this stays one schema, not a parallel one.",
  "type": "object",
  "additionalProperties": false,
  "required": ["name", "type", "title", "description", "version", "integrity", "dependencies", "cssVars", "docs", "files"],
  "properties": {
    "$schema": { "type": "string" },
    "name": {
      "type": "string",
      "pattern": "^[a-z][a-z0-9-]*$",
      "description": "Unique kebab-case identifier — matches the registry/<name>.json filename and the module/pattern's own subpath name (essay, broadsheet, forms, palette-deck)."
    },
    "type": {
      "type": "string",
      "enum": ["remarque:contract"],
      "description": "Adapted from shadcn's per-item `type`. Every Remarque registry item is the same kind of thing — a versioned, hash-pinned pairing of a CSS module (if any) and its known-good markup usage sample — so one value covers all items today; a second value would only be minted for a future item that is genuinely a different KIND of contract, not just a different module."
    },
    "title": { "type": "string", "description": "Human-readable title. Required here (optional in shadcn's schema) — every Remarque item is a public artifact, not local dev scaffolding." },
    "description": { "type": "string", "description": "One- or two-sentence summary of what the module/pattern is for." },
    "version": {
      "type": "string",
      "description": "The remarque-tokens package version this item was generated from — SECURITY: pinned so a consumer can assert freshness/provenance against a known release, not an unversioned floating fetch."
    },
    "integrity": {
      "type": "string",
      "pattern": "^sha256-[A-Za-z0-9+/]+=*$",
      "description": "SECURITY: sha256 content hash of this item's files (scripts/lib/registry-extract.mjs's sha256OfFiles, same sha256-<base64> shape as W3C Subresource Integrity), computed at build time. A consumer that fetches this item over HTTPS can recompute the hash over `files` and refuse to apply the payload if it doesn't match — the same trust model as any other SRI-pinned fetch."
    },
    "dependencies": {
      "type": "array",
      "items": { "type": "string" },
      "description": "NPM package(s) this item's CSS assumes is already loaded. Every item lists \"remarque-tokens\" here — the design-tokens package (tokens-core.css/tokens-palette.css) this item's `cssVars` consume is modeled as this ordinary npm dependency, not as a fifth registry item and not as a registryDependencies entry: tokens.json/tokens.schema.json already exist as a separate, purpose-built machine-readable artifact (issue #99), and a registry item that re-embedded the full token set would duplicate that artifact rather than single-source it."
    },
    "registryDependencies": {
      "type": "array",
      "items": { "type": "string" },
      "description": "Adapted from shadcn's field of the same name (other registry items this one depends on). Empty/omitted for every current item — essay/broadsheet/forms/palette-deck are independent opt-ins with no inter-item dependency, per REMARQUE.md's Essay Module and Broadsheet \"When to use\" sections."
    },
    "cssVars": {
      "type": "array",
      "items": { "type": "string", "pattern": "^--[a-z0-9-]+$" },
      "description": "DIVERGENCE from shadcn: shadcn's `cssVars` holds {theme,light,dark} VALUES to merge into a consumer's stylesheet. This registry ships whole CSS files verbatim in `files` instead (single-sourced from the real .css, never a second hand-copied value), so there is nothing to merge — `cssVars` here is repurposed as the flat, deduped list of palette-tier `--color-*`/other custom-property NAMES this item's CSS actually reads (derived mechanically via `var(...)` grep over the shipped CSS, never hand-maintained). Empty for palette-deck, which ships no CSS of its own."
    },
    "docs": {
      "type": "string",
      "pattern": "^https://",
      "description": "DIVERGENCE from shadcn: shadcn's `docs` is a markdown blob. This registry's `docs` is a single HTTPS URL into the relevant REMARQUE.md section (SECURITY: https:// only, checked by scripts/test-registry.mjs) — the registry deliberately does not duplicate spec prose; it points back at the one place that prose lives."
    },
    "files": {
      "type": "array",
      "minItems": 1,
      "items": { "$ref": "#/$defs/file" },
      "description": "The payload. Adapted from shadcn's `files` (path/content/type kept; `target` omitted — see the top-level description) — every entry is inline HTML/CSS text data. SECURITY (blocking): no entry may contain executable content; scripts/test-registry.mjs asserts no file's content contains a literal `<script` substring, across every item without exception."
    }
  },
  "$defs": {
    "file": {
      "type": "object",
      "additionalProperties": false,
      "required": ["path", "content", "type"],
      "properties": {
        "path": { "type": "string", "description": "Path relative to this item's own directory, e.g. \"essay.css\" or \"usage.html\"." },
        "content": { "type": "string", "description": "The file's full, verbatim text content — for a CSS file, read from the real .css at build time (never duplicated by hand); for usage.html, extracted from REMARQUE.md's own fenced markup-contract sample via a `registry-usage:<name>` marker (scripts/lib/registry-extract.mjs)." },
        "type": {
          "type": "string",
          "enum": ["remarque:css", "remarque:markup"],
          "description": "DIVERGENCE from shadcn: shadcn's per-file `type` reuses the same registry:* vocabulary as the item-level `type`, for CLI install-target resolution. There is no installer here, so this names what the file actually IS instead — a whole CSS module (remarque:css) or an HTML markup-contract sample (remarque:markup)."
        }
      }
    }
  }
}
